{"agentprov_version":"0.1.0","command":"recompute","corpus":{"content_digest":null,"corpus_id":"dtap-bench","root":"(dry run: private temporary tree, removed)","state":"working"},"counters":{"annotated":66885,"changed_explained":0,"corpus_unexplained":2,"derived":66885,"failed":0,"identical":66878,"index_refreshed":0,"raw_copied":0,"raw_linked":107966,"raw_verified":107966,"recomputed":66886,"selected":67708,"stages_run":4,"unexplained_change":8,"unverified":830,"validated":66885,"withheld_unavailable":83},"dry_run":true,"exit_code":1,"failures":[{"code":"prov.failed","detail":"worker.limit.output","stage":"prov","subject":{"ex":"ex_dwfigpikkplrr2pbquamoeku2o"}},{"code":"sem.failed","detail":"dtap.tools@3: worker.limit.output","stage":"sem","subject":{"ex":"ex_dwfigpikkplrr2pbquamoeku2o"}}],"failures_truncated":false,"format":"agentprov-cli-summary/0.1","issues_by_code":{},"notices":["raw objects withheld by the source are absent: the executions that need them are unverified, not re-derived (H.4.5(6))","raw/origins.jsonl differs (4 line(s) removed, 0 added): UNEXPLAINED","register.jsonl differs (6 line(s) removed, 111 added): UNEXPLAINED"],"options":{"break_stale_lock":false,"corpus":"<home>/.agentprov/corpora/dtap-bench-w2c","dry_run":true,"in_process":false,"jobs":12,"link_raw":false,"max_listed":100,"no_reuse":false,"no_validation_cache":false,"prov_spec":[],"show_diff":0,"skip_prov_conformance":false,"strict":false},"outcome":"failures","refusal":null}
